COURSE,YEAR,INTEGRANTES
Processo de Trabalho Agrícola no uso e prevenção de Intoxicações por agrotóxicos,1998,['Gilmar Laforga']
Compostagem a partir de resíduos de varrição,2012,"['Gilmar Laforga', 'Rafael Almeida Mantelli', 'Magno Dias Ávila', 'Arthur Vinicius Siqueira Souza']"
Comercialização e mercados: estratégia para a inserção dos produtos da reforma agrária nos mercados nacionais e internacionais,2004,"['Gilmar Laforga', 'Cristiane Betanho', 'Farid Eid', 'Rosaura MC de Oliveira']"
Uso e Segurança de Máquinas Agrícolas.,2010,"['Aurasil Ferreira Garcia', 'Gilmar Laforga']"
Edição e Programação de Extensão Rural para o Rádio,2013,['Gilmar Laforga']
Comunicação na prática extensionista,2011,"['Gilmar Laforga', 'Aldo Max Custódio', 'Diane Cristina Stefanoski', 'Ticiana Petean Pina']"
