TITLE,YEAR,LANG,EDITORA,AUTHOR,ORDER
Certificação Social: o comércio justo como alternativa à agricultura familiar brasileira,2006,Português,Editora UNEMAT,['Gilmar Laforga'],['1']
"Organização Familiar Rural da Gleba Triângulo, Tangará da Serra - MT",2009,Português,Editora Unemat,"['Sandro Benedito Sguarezi', 'Jorge Luiz Schirmer Mattos', 'Gilmar Laforga', 'Wilson Luconi Jr']","['1', '2', '3', '4']"
"Economia Solidária, Agricultura Familiar e Comércio Justo: alinhando convergências, apresentando desafios",2009,Português,Editora da Unemat,['Gilmar Laforga'],['1']
Movimento dos homens e a luta pela terra no Mato Grosso,2012,Português,Arte e Ciência,"['Raimundo Nonato Cunha de França', 'Marinês da Rosa', 'Gilmar Laforga', 'Bruna Raquel Winck']","['1', '2', '3', '4']"
"Assentamento, Agroecologia e Economia Solidária: a pós-graduação lato sensu em agricultura familiar camponesa e educação do campo",2012,Português,Arte e Ciência,"['Sandro Benedito Sguarezi', 'Jorge Luiz Schirmer de Mattos', 'Gilmar Laforga', 'Wilson Luconi Jr']","['1', '2', '3', '4']"
Universidade e movimentos sociais: interfaces na perspectiva da agroecologia e da economia solidaria.,2011,Português,Unijuí,"['Sandro Benedito Sguarezi', 'Ana Maria de Lima', 'Anderson G. Froehlich', 'Jorge Luiz Schirmer de Mattos', 'José Pereira Filho', 'Gilmar Laforga']","['1', '2', '3', '4', '5', '6']"
"Agroecologia, Economia Solidária e Desenvolvimento Sustentável princípios da Pós-Graduação em Agricultura Familiar e Camponesa e Educação do Campo-Residência Agrária em Tangará da Serra-MT",2012,Português,Editorial Universitária Felix Varela,"['Sandro Benedito Sguarezi', 'Jorge Luiz Schirmer de Mattos', 'Juliano Luis Borges', 'Wilson Luconi Jr', 'Gilmar Laforga']","['1', '2', '3', '4', '5']"
Pós-graduação Lato Sensu e capacitação de lideranças comunitárias em economia solidária,2011,Português,Editora CRV/ Editora Unemat,"['Juliano Luis Borges', 'Gilmar Laforga']","['1', '2']"
Organização participativa da rede de produção e consumo solidário entre camponeses do Assentamento Antônio Conselheiro e consumidores de Tangará da Serra-MT,2011,Português,Editora CRV/ Editora Unemat,"['Sandro Benedito Sguarezi', 'Tércio Nogueira', 'Gilmar Laforga', 'Jorge Luiz Schirmer de Mattos', 'Juliano Luis Borges']","['1', '2', '3', '4', '5']"
