PROJ,YEAR_INI,YEAR_FIN,NATUREZA,INTEGRANTES,COORDENA,ID,FULL_NAME,LAST_NAME,CITADO,CITY,STATE,RESUME,UPDATE,OR
MT Horticultura: canal de comunicação com os produtores rurais de Mato Grosso,2015,ATUAL,EXTENSAO,"['José Roberto Rambo', 'Gilmar Laforga', 'Willian Krause', 'Adalberto Santi', 'Kelvin Shin-iti Kabeya']","['NAO', 'NAO', 'SIM', 'NAO', 'NAO']",8190371175828378,José Roberto Rambo,Rambo,"RAMBO, J. R.;RAMBO, JOSÉ ROBERTO",Pirapó,RS,Nao foi possivel extrair o resumo,21-02-2019,1
"Coleta, Análise e Divulgação de Preços de Itens de Supermercados em Tangará da Serra-MT",2017,ATUAL,EXTENSAO,"['José Roberto Rambo', 'Gilmar Laforga', 'Karine Medeiros Anunciatto', 'Vanderson Ricardo Jorge', 'Julio da Silva Pereira', 'Jakciane Eggert']","['SIM', 'NAO', 'NAO', 'NAO', 'NAO', 'NAO']",8190371175828378,José Roberto Rambo,Rambo,"RAMBO, J. R.;RAMBO, JOSÉ ROBERTO",Pirapó,RS,Nao foi possivel extrair o resumo,21-02-2019,1
Análise de Eficiência na Utilização de Recursos e no Atendimento a População do Programa de Aquisição de Alimentos (PAA) no Território do Alto Paraguai em Mato Grosso,2017,ATUAL,PESQUISA,"['José Roberto Rambo', 'Gilmar Laforga', 'Raimundo Nonato Cunha de França', 'Sandro Benedito Sguarezi', 'SABBAG, OMAR JORGE', 'Anderson Gheller Froehlich']","['SIM', 'NAO', 'NAO', 'NAO', 'NAO', 'NAO']",8190371175828378,José Roberto Rambo,Rambo,"RAMBO, J. R.;RAMBO, JOSÉ ROBERTO",Pirapó,RS,Nao foi possivel extrair o resumo,21-02-2019,1
GRUPOS DE ATER: diálogos e práticas de extensão rural,2017,ATUAL,EXTENSAO,"['José Roberto Rambo', 'Gilmar Laforga', 'Adalberto Santi', 'Raimundo Nonato Cunha de França', 'Rafael Cesar Tieppo', 'Márcio Osvaldo Lima Magalhães', 'Anísio da Silva Nunes']","['NAO', 'SIM', 'NAO', 'NAO', 'NAO', 'NAO', 'NAO']",8190371175828378,José Roberto Rambo,Rambo,"RAMBO, J. R.;RAMBO, JOSÉ ROBERTO",Pirapó,RS,Nao foi possivel extrair o resumo,21-02-2019,1
"Fortalecimento da Agroindústria Familiar em Tangará da Serra: diagnóstico, assistência técnica e extensão rural em assentamentos rurais",2018,ATUAL,EXTENSAO,"['José Roberto Rambo', 'Gilmar Laforga', 'Rogério Gonçalves Lacerda de Gouveia', 'Raimundo Nonato Cunha de França', 'Sandro Benedito Sguarezi', 'Jakciane Eggert', 'Anderson Gheller Froehlich', 'Agnaldo Soares Damacena']","['SIM', 'NAO', 'NAO', 'NAO', 'NAO', 'NAO', 'NAO', 'NAO']",8190371175828378,José Roberto Rambo,Rambo,"RAMBO, J. R.;RAMBO, JOSÉ ROBERTO",Pirapó,RS,Nao foi possivel extrair o resumo,21-02-2019,1
Agronomia no Campo: Agricultura de Base Ecológica em questão.,2009,2011,EXTENSAO,"['José Roberto Rambo', 'Cleiton Lopes da Silva']","['SIM', 'NAO']",8190371175828378,José Roberto Rambo,Rambo,"RAMBO, J. R.;RAMBO, JOSÉ ROBERTO",Pirapó,RS,Nao foi possivel extrair o resumo,21-02-2019,1
"Capacitação Técnica e Organizacional das famílias do Assentamento Estrela da Ilha, em Ilha Solteira (SP).",2014,2016,EXTENSAO,"['José Roberto Rambo', ""Antonio Lázaro Sant'Ana"", 'Murilo Didonet de Moraes', 'Ticiana Petean Pina']","['NAO', 'SIM', 'NAO', 'NAO']",8190371175828378,José Roberto Rambo,Rambo,"RAMBO, J. R.;RAMBO, JOSÉ ROBERTO",Pirapó,RS,Nao foi possivel extrair o resumo,21-02-2019,1
Núcleos de Extensão em Desenvolvimento Territorial dos Territórios de Andradina e do Noroeste Paulista,2014,2016,PESQUISA,"['José Roberto Rambo', 'Maria Aparecida Anselmo Tarsitano', ""Antonio Lázaro Sant'Ana"", 'Ticiana Petean Pina', 'Douglas de Araújo Gonzaga', 'Valéria da Silva Modenese', 'Luciana Carvalho de Oliveira', 'Étorre Santiago Zalinelo Monteiro']","['NAO', 'NAO', 'SIM', 'NAO', 'NAO', 'NAO', 'NAO', 'NAO']",8190371175828378,José Roberto Rambo,Rambo,"RAMBO, J. R.;RAMBO, JOSÉ ROBERTO",Pirapó,RS,Nao foi possivel extrair o resumo,21-02-2019,1
