PROJ,YEAR_INI,YEAR_FIN,NATUREZA,INTEGRANTES,COORDENA,ID,FULL_NAME,LAST_NAME,CITADO,CITY,STATE,RESUME,UPDATE,OR
Temperatura no perfil do solo utilizando duas densidades de cobertura e solo nu,2000,2005,PESQUISA,"['Rivanildo Dallacort', 'Reinaldo Prandini Ricieri', 'Suedêmio de Lima Silva', 'Estor Gnoatto', 'Eloi Gasparim']","['NAO', 'NAO', 'NAO', 'NAO', 'SIM']",1292986021348016,Rivanildo Dallacort,Dallacort,"DALLACORT, R;DALLACORT, Rivanildo;Dallacort, R.;DALLACORT, R.;DALLACORT;Dallacort;RIVANILDO, DALLACORT",São João,PR,Nao foi possivel extrair o resumo,24-01-2019,1
"Caracterização agroclimática da região de Cascavel - Paraná, aplicada ao cultivo de culturas agrícolas",2000,2002,PESQUISA,"['Rivanildo Dallacort', 'Reinaldo Prandini Ricieri', 'Suedêmio de Lima Silva', 'Wellian Chaves Monteiro Silva']","['NAO', 'NAO', 'NAO', 'SIM']",1292986021348016,Rivanildo Dallacort,Dallacort,"DALLACORT, R;DALLACORT, Rivanildo;Dallacort, R.;DALLACORT, R.;DALLACORT;Dallacort;RIVANILDO, DALLACORT",São João,PR,Nao foi possivel extrair o resumo,24-01-2019,1
Avaliação do desempenho de painéis fotovoltaicos para geração de energia elétrica e bombeamento de água,1999,2004,PESQUISA,"['Rivanildo Dallacort', 'Reinaldo Prandini Ricieri', 'Suedêmio de Lima Silva', 'Estor Gnoatto', 'Evandro Marcos Kolling', 'Samoel Nelson Melegari Souza', 'Yuri Ferruzzi']","['NAO', 'NAO', 'NAO', 'NAO', 'SIM', 'NAO', 'NAO']",1292986021348016,Rivanildo Dallacort,Dallacort,"DALLACORT, R;DALLACORT, Rivanildo;Dallacort, R.;DALLACORT, R.;DALLACORT;Dallacort;RIVANILDO, DALLACORT",São João,PR,Nao foi possivel extrair o resumo,24-01-2019,1
"Modelos numéricos de estimativa da irradiação solar (global, difusa e direta) e comparação da medida monitorada por diferentes instrumentos",2001,2004,PESQUISA,"['Rivanildo Dallacort', 'Reinaldo Prandini Ricieri', 'Suedêmio de Lima Silva', 'Wellian Chaves Monteiro Silva', 'Estor Gnoatto']","['SIM', 'NAO', 'NAO', 'NAO', 'NAO']",1292986021348016,Rivanildo Dallacort,Dallacort,"DALLACORT, R;DALLACORT, Rivanildo;Dallacort, R.;DALLACORT, R.;DALLACORT;Dallacort;RIVANILDO, DALLACORT",São João,PR,Nao foi possivel extrair o resumo,24-01-2019,1
Resistência a compressão do solo-cimento com substituição parcial do cimento Portland por resíduo cerâmico moído,2001,2002,PESQUISA,"['Rivanildo Dallacort', 'Fabio Luiz Willrich', 'Humberto Correa Lima Junior']","['SIM', 'NAO', 'NAO']",1292986021348016,Rivanildo Dallacort,Dallacort,"DALLACORT, R;DALLACORT, Rivanildo;Dallacort, R.;DALLACORT, R.;DALLACORT;Dallacort;RIVANILDO, DALLACORT",São João,PR,Nao foi possivel extrair o resumo,24-01-2019,1
Utilização de águas residuárias na agricultura,2003,2004,PESQUISA,"['Rivanildo Dallacort', 'Frederico Fonseca da Silva', 'Altair Bertonha', 'Paulo Sérgio Lourenço de Freitas']","['NAO', 'SIM', 'NAO', 'NAO']",1292986021348016,Rivanildo Dallacort,Dallacort,"DALLACORT, R;DALLACORT, Rivanildo;Dallacort, R.;DALLACORT, R.;DALLACORT;Dallacort;RIVANILDO, DALLACORT",São João,PR,Nao foi possivel extrair o resumo,24-01-2019,1
Modelo de simulação da produtividade da cultura do feijão para a região de Maringá - PR,2003,2008,PESQUISA,"['Rivanildo Dallacort', 'João Batista Tolentino Junior', 'Rogério Teixeira de Faria', 'Antonio Carlos Andrade Gonçalves', 'Paulo Sérgio Lourenço de Freitas']","['SIM', 'NAO', 'NAO', 'NAO', 'NAO']",1292986021348016,Rivanildo Dallacort,Dallacort,"DALLACORT, R;DALLACORT, Rivanildo;Dallacort, R.;DALLACORT, R.;DALLACORT;Dallacort;RIVANILDO, DALLACORT",São João,PR,Nao foi possivel extrair o resumo,24-01-2019,1
"Determinação das melhores épocas de semeadura antecipada da soja, visando o plantio do milho safrinha, para as regiões de Palotina, Cascavel e Maringá, Estado do Paraná",2004,2008,PESQUISA,"['Rivanildo Dallacort', 'Altair Bertonha', 'Roberto Rezende', 'Rogério Teixeira de Faria', 'Rosilaine Araldi', 'Antonio Carlos Andrade Gonçalves', 'Paulo Sérgio Lourenço de Freitas']","['NAO', 'NAO', 'NAO', 'NAO', 'NAO', 'NAO', 'SIM']",1292986021348016,Rivanildo Dallacort,Dallacort,"DALLACORT, R;DALLACORT, Rivanildo;Dallacort, R.;DALLACORT, R.;DALLACORT;Dallacort;RIVANILDO, DALLACORT",São João,PR,Nao foi possivel extrair o resumo,24-01-2019,1
"Diversificação e ampliação da base produtiva do Estado de Grosso, a partir do zoneamento agrícola da soja, feijão, cana-de-açúcar, girassol, crambe e pinhão-manso",2012,2015,PESQUISA,"['Rivanildo Dallacort', 'Cornélio Alberto Zolin', 'Rafael Cesar Tieppo', 'Miriam Hiroko Inoue', 'Paulo Sérgio Lourenço de Freitas', 'Karolina Ascari de Souza', 'Adalberto Santi']","['SIM', 'NAO', 'NAO', 'NAO', 'NAO', 'NAO', 'NAO']",1292986021348016,Rivanildo Dallacort,Dallacort,"DALLACORT, R;DALLACORT, Rivanildo;Dallacort, R.;DALLACORT, R.;DALLACORT;Dallacort;RIVANILDO, DALLACORT",São João,PR,Nao foi possivel extrair o resumo,24-01-2019,1
Centro Integrado Cerrado de Pesquisa nos Campi de Nova Xavantina e Tangará da Serra,2012,ATUAL,DESENVOLVIMENTO,"['Rivanildo Dallacort', 'Monica Josene Barbosa Pereira', 'Edinéia Aparecida dos Santos Galvanin', 'Agnaldo Rodrigues da Silva', 'Vera Lucia da Rocha Maquea', 'Walnice Aparecida Matos Vilalva', 'Helena Soares Ramos Cabette', 'Eddie Lenza de Oliveira', 'Beatriz Schwantes Marimon', 'Marco Antonio Camillo de Carvalho']","['SIM', 'NAO', 'NAO', 'NAO', 'NAO', 'NAO', 'NAO', 'NAO', 'NAO', 'NAO']",1292986021348016,Rivanildo Dallacort,Dallacort,"DALLACORT, R;DALLACORT, Rivanildo;Dallacort, R.;DALLACORT, R.;DALLACORT;Dallacort;RIVANILDO, DALLACORT",São João,PR,Nao foi possivel extrair o resumo,24-01-2019,1
Aplicação e transferência de tecnologias na otimização de sistemas agrícolas sustentáveis,2010,2017,PESQUISA,"['Rivanildo Dallacort', 'João Cleber Modernel da Silveira', 'Rafael Cesar Tieppo', 'Santino Seabra Junior', 'Maria Cândida Moitinho Nunes', 'Elisangela Clarete Camili', 'Nuno Rodrigo Madeira', 'Antônio Nobre da Silva', 'Decio Mossini Junior', 'Fabricio Schwanz da Silva', 'Sandra Mara Alves da Silva Neves', 'Marco Antonio Camillo de Carvalho', 'Karin Daniely Prestes da Silva', 'Adalberto Santi']","['SIM', 'NAO', 'NAO', 'NAO', 'NAO', 'NAO', 'NAO', 'NAO', 'NAO', 'NAO', 'NAO', 'NAO', 'NAO', 'NAO']",1292986021348016,Rivanildo Dallacort,Dallacort,"DALLACORT, R;DALLACORT, Rivanildo;Dallacort, R.;DALLACORT, R.;DALLACORT;Dallacort;RIVANILDO, DALLACORT",São João,PR,Nao foi possivel extrair o resumo,24-01-2019,1
Influência do Clima no Ambiente: Região de Tangará da Serra,2009,2011,EXTENSAO,"['Rivanildo Dallacort', 'Dionei José da Silva', 'Eliane Ignot']","['SIM', 'NAO', 'NAO']",1292986021348016,Rivanildo Dallacort,Dallacort,"DALLACORT, R;DALLACORT, Rivanildo;Dallacort, R.;DALLACORT, R.;DALLACORT;Dallacort;RIVANILDO, DALLACORT",São João,PR,Nao foi possivel extrair o resumo,24-01-2019,1
Campus a Campo: Ações extensionistas com a agricultura familiar de Tangará da Serra-MT,2013,2016,EXTENSAO,"['Rivanildo Dallacort', 'Monica Josene Barbosa Pereira', 'Raimundo Nonato de França Cunha', 'WILLIAN KRAUSE', 'José Roberto Rambo', 'Samuel Laudelino Silva', 'Idilaine de Fatima Lima', 'Dejânia Vieira de Araújo', 'Adalberto Santi']","['NAO', 'NAO', 'NAO', 'NAO', 'SIM', 'NAO', 'NAO', 'NAO', 'NAO']",1292986021348016,Rivanildo Dallacort,Dallacort,"DALLACORT, R;DALLACORT, Rivanildo;Dallacort, R.;DALLACORT, R.;DALLACORT;Dallacort;RIVANILDO, DALLACORT",São João,PR,Nao foi possivel extrair o resumo,24-01-2019,1
"Avaliação de riscos a saúde dos moradores de Tangará da Serra, devido aos efeitos de alterações climáticas e da microbiota de fungos alérgicos da atmosfera",2007,2010,PESQUISA,"['Rivanildo Dallacort', 'Dionei José da Silva', 'Eliane Ignot', 'Ilio Fealho de Carvalho', 'Ageo Candido Mário da Silva', 'Adalberto Santi']","['SIM', 'NAO', 'NAO', 'NAO', 'NAO', 'NAO']",1292986021348016,Rivanildo Dallacort,Dallacort,"DALLACORT, R;DALLACORT, Rivanildo;Dallacort, R.;DALLACORT, R.;DALLACORT;Dallacort;RIVANILDO, DALLACORT",São João,PR,Nao foi possivel extrair o resumo,24-01-2019,1
Lixiviação e efeito residual de herbicidas utilizados na cultura da cana-de-açúcar no Estado de Mato Grosso,2009,2011,PESQUISA,"['Rivanildo Dallacort', 'Virginia Helena de Azevedo', 'Rubem Silvério de Oliveira Junior', 'Adley Bergson Gonçalves de Abreu', 'Eliana Freire Gaspar de Carvalho Dores', 'Ana Cássia Silva Possamai', 'Miriam Hiroko Inoue']","['SIM', 'NAO', 'NAO', 'NAO', 'NAO', 'NAO', 'NAO']",1292986021348016,Rivanildo Dallacort,Dallacort,"DALLACORT, R;DALLACORT, Rivanildo;Dallacort, R.;DALLACORT, R.;DALLACORT;Dallacort;RIVANILDO, DALLACORT",São João,PR,Nao foi possivel extrair o resumo,24-01-2019,1
Biodisponibilidade e potencial de extração de nutrientes de substratos pelo tomateiro produzido em ambiente protegido,2012,2016,PESQUISA,"['Rivanildo Dallacort', 'Walcylene Lacerda Mattos Pereira Scaramuzza', 'José Fernando Scaramuzza', 'WILLIAN KRAUSE', 'José Roberto Rambo', 'Adalberto Santi']","['NAO', 'NAO', 'NAO', 'NAO', 'NAO', 'SIM']",1292986021348016,Rivanildo Dallacort,Dallacort,"DALLACORT, R;DALLACORT, Rivanildo;Dallacort, R.;DALLACORT, R.;DALLACORT;Dallacort;RIVANILDO, DALLACORT",São João,PR,Nao foi possivel extrair o resumo,24-01-2019,1
"Avaliação da torta de filtro no cultivo da alface em diferentes épocas de semeadura, sob cultivo protegido e céu aberto.",2008,2010,PESQUISA,"['Rivanildo Dallacort', 'Márcio Lustosa Santos', 'Marice Cristina Vendrucullo', 'Dejânia Vieira de Araújo', 'Adalberto Santi']","['NAO', 'NAO', 'NAO', 'NAO', 'SIM']",1292986021348016,Rivanildo Dallacort,Dallacort,"DALLACORT, R;DALLACORT, Rivanildo;Dallacort, R.;DALLACORT, R.;DALLACORT;Dallacort;RIVANILDO, DALLACORT",São João,PR,Nao foi possivel extrair o resumo,24-01-2019,1
Transmissibilidade de Colletotrichum gossypii var. cephalosporioides e Colletotrichum dematium var. truncata associados às sementes de algodão e de soja e o estudo epidemiológico da ramulose e da antracnose em mato grosso.,2008,2012,PESQUISA,"['Rivanildo Dallacort', 'Virginia Helena de Azevedo', 'Elisandra Batista Zambenedetti Magnani', 'Jane Rodrigues de Assis Machado', 'José da Cruz Machado', 'Marcelo de C. Alves', 'Jaqueline A. Pizzato', 'Dejânia Vieira de Araújo']","['NAO', 'NAO', 'NAO', 'NAO', 'NAO', 'NAO', 'NAO', 'SIM']",1292986021348016,Rivanildo Dallacort,Dallacort,"DALLACORT, R;DALLACORT, Rivanildo;Dallacort, R.;DALLACORT, R.;DALLACORT;Dallacort;RIVANILDO, DALLACORT",São João,PR,Nao foi possivel extrair o resumo,24-01-2019,1
Diversificação e ampliação da base produtiva da bacia do Alto Paraguai como estratégia inovadora na otimização dos sistemas agrícolas regionais,2013,2015,PESQUISA,"['Rivanildo Dallacort', 'Rafael Cesar Tieppo', 'Paulo Sérgio Lourenço de Freitas', 'William Fenner', 'Adalberto Santi', 'Cleonir Andrade Faria Júnior']","['SIM', 'NAO', 'NAO', 'NAO', 'NAO', 'NAO']",1292986021348016,Rivanildo Dallacort,Dallacort,"DALLACORT, R;DALLACORT, Rivanildo;Dallacort, R.;DALLACORT, R.;DALLACORT;Dallacort;RIVANILDO, DALLACORT",São João,PR,Nao foi possivel extrair o resumo,24-01-2019,1
Otimização dos recursos hídricos aplicados a culturas agrícolas no Estado de Mato Grosso - Brasil,2015,ATUAL,PESQUISA,"['Rivanildo Dallacort', 'Rafael Cesar Tieppo', 'Santino Seabra Junior', 'Paulo Sérgio Lourenço de Freitas', 'William Fenner', 'Karolina Ascari de Souza', 'Adalberto Santi', 'Cleonir Andrade Faria Júnior', 'MARCO ANTONIO CAMILLO DE CARVALHO', 'André Tavares de Vasconcelos', 'Bianca Nathiele Favetti Chagas', 'Guilherme Bariviera', 'João Danilo Barbieri', 'Raimundo Nonato Cunha de França', 'raquel serrano baldisera', 'Emerson Luiz Hoffmann', 'Daiane Maria Haubricht']","['SIM', 'NAO', 'NAO', 'NAO', 'NAO', 'NAO', 'NAO', 'NAO', 'NAO', 'NAO', 'NAO', 'NAO', 'NAO', 'NAO', 'NAO', 'NAO', 'NAO']",1292986021348016,Rivanildo Dallacort,Dallacort,"DALLACORT, R;DALLACORT, Rivanildo;Dallacort, R.;DALLACORT, R.;DALLACORT;Dallacort;RIVANILDO, DALLACORT",São João,PR,Nao foi possivel extrair o resumo,24-01-2019,1
Variabilidade da temperatura e evaporação da água sob diferentes coberturas de solo e sua influência no Kc dual da cultura do milho,2015,ATUAL,PESQUISA,"['Rivanildo Dallacort', 'Rafael Cesar Tieppo', 'Paulo Sergio Lourenço de Freitas', 'Karolina Ascari de Souza', 'Dejânia Vieira de Araújo', 'Adalberto Santi', 'André Tavares de Vasconcelos', 'Guilherme Bariviera', 'João Danilo Barbieri', 'Alice Medeiros Osti', 'Adelair mendes Conceição', 'Francielle Freitas Vieira']","['SIM', 'NAO', 'NAO', 'NAO', 'NAO', 'NAO', 'NAO', 'NAO', 'NAO', 'NAO', 'NAO', 'NAO']",1292986021348016,Rivanildo Dallacort,Dallacort,"DALLACORT, R;DALLACORT, Rivanildo;Dallacort, R.;DALLACORT, R.;DALLACORT;Dallacort;RIVANILDO, DALLACORT",São João,PR,Nao foi possivel extrair o resumo,24-01-2019,1
Modelo para predição de dias agronomicamente viáveis para operações agrícolas mecanizadas,2017,ATUAL,PESQUISA,"['Rivanildo Dallacort', 'Erivelto Mercante', 'Rafael Cesar Tieppo', 'Adalberto Santi', 'André Tavares de Vasconcelos', 'João Danilo Barbieri', 'Maria Carolina Silva Andrea', 'Thiago Libório Romanelli', 'Emili Ferreira Campachi', 'Julia Gallo Barreto']","['NAO', 'NAO', 'SIM', 'NAO', 'NAO', 'NAO', 'NAO', 'NAO', 'NAO', 'NAO']",1292986021348016,Rivanildo Dallacort,Dallacort,"DALLACORT, R;DALLACORT, Rivanildo;Dallacort, R.;DALLACORT, R.;DALLACORT;Dallacort;RIVANILDO, DALLACORT",São João,PR,Nao foi possivel extrair o resumo,24-01-2019,1
"Rede Floresta (ReFlor): biodiversidade, mudanças climáticas e biotecnologia no Arco do Desmatamento",2017,ATUAL,PESQUISA,"['Rivanildo Dallacort', 'Beatriz Schwantes Marimon', 'MARIMON JUNIOR, BEN HUR', 'Oliver Phillips', 'Yadvinder Malhi', 'Ricardo Keichi Umetsu', 'Emanuel Gloor', 'David Galbraith', 'Maria Antônia Carniello', 'Celice Alexandre Silva']","['NAO', 'NAO', 'SIM', 'NAO', 'NAO', 'NAO', 'NAO', 'NAO', 'NAO', 'NAO']",1292986021348016,Rivanildo Dallacort,Dallacort,"DALLACORT, R;DALLACORT, Rivanildo;Dallacort, R.;DALLACORT, R.;DALLACORT;Dallacort;RIVANILDO, DALLACORT",São João,PR,Nao foi possivel extrair o resumo,24-01-2019,1
Transição Cerrado-Amazônia: bases ecológicas e sócio-ambientais para a conservação (etapa III),2016,ATUAL,PESQUISA,"['Rivanildo Dallacort', 'Beatriz Schwantes Marimon', 'MARIMON JUNIOR, BEN HUR', 'Bruna Martins de Lima', 'Celice Alexandre Silva', 'Mara Silvia Aguiar Abdo', 'Diogo Andrade Costa']","['NAO', 'SIM', 'NAO', 'NAO', 'NAO', 'NAO', 'NAO']",1292986021348016,Rivanildo Dallacort,Dallacort,"DALLACORT, R;DALLACORT, Rivanildo;Dallacort, R.;DALLACORT, R.;DALLACORT;Dallacort;RIVANILDO, DALLACORT",São João,PR,Nao foi possivel extrair o resumo,24-01-2019,1
Projeto de extensão em Engenharia de Sistemas Agrícolas,2016,ATUAL,EXTENSAO,"['Rivanildo Dallacort', 'Rafael Cesar Tieppo', 'Adalberto Santi', 'Ricardo José da Silva']","['NAO', 'SIM', 'NAO', 'NAO']",1292986021348016,Rivanildo Dallacort,Dallacort,"DALLACORT, R;DALLACORT, Rivanildo;Dallacort, R.;DALLACORT, R.;DALLACORT;Dallacort;RIVANILDO, DALLACORT",São João,PR,Nao foi possivel extrair o resumo,24-01-2019,1
Determinação da evapotranspiração potencial e da adaptabilidade edafoclimática da cultura do pinhão manso na região de Tangara da Serra,2007,2009,PESQUISA,"['Rivanildo Dallacort', 'Astor Henrique Nied', 'Marice Cristina Vendrucullo', 'WILLIAN KRAUSE']","['SIM', 'NAO', 'NAO', 'NAO']",1292986021348016,Rivanildo Dallacort,Dallacort,"DALLACORT, R;DALLACORT, Rivanildo;Dallacort, R.;DALLACORT, R.;DALLACORT;Dallacort;RIVANILDO, DALLACORT",São João,PR,Nao foi possivel extrair o resumo,24-01-2019,1
Centro Tecnológico de Geoprocessamento e Sensoriamento Remoto aplicado à produção de Biodiesel - CETEGEO-SR.,2008,ATUAL,PESQUISA,"['Rivanildo Dallacort', 'Edenir Maria Serigatto', 'Edinéia Aparecida dos Santos Galvanin', 'Rafael Cesar Tieppo', 'Dejânia Vieira de Araújo', 'Adalberto Santi', 'Bruna Martins de Lima']","['SIM', 'NAO', 'NAO', 'NAO', 'NAO', 'NAO', 'NAO']",1292986021348016,Rivanildo Dallacort,Dallacort,"DALLACORT, R;DALLACORT, Rivanildo;Dallacort, R.;DALLACORT, R.;DALLACORT;Dallacort;RIVANILDO, DALLACORT",São João,PR,Nao foi possivel extrair o resumo,24-01-2019,1
Caracterização da pluviometria e do potencial erosivo das chuvas de Mato Grosso,2008,2010,PESQUISA,"['Rivanildo Dallacort', 'Cassiano Cremon', 'Carlos Ricardo Fietz', 'Eder Comunello']","['NAO', 'NAO', 'SIM', 'NAO']",1292986021348016,Rivanildo Dallacort,Dallacort,"DALLACORT, R;DALLACORT, Rivanildo;Dallacort, R.;DALLACORT, R.;DALLACORT;Dallacort;RIVANILDO, DALLACORT",São João,PR,Nao foi possivel extrair o resumo,24-01-2019,1
Efeito da profundidadede semeadura de uma semeadora de plantio direto e desenvolvimento inicial de milho (Zea mays L.),2003,2004,PESQUISA,"['Rafael Cesar Tieppo', 'Antonio Gabriel Filho', 'Douglas Guedes Batista Torres', 'João Cleber Modernel da Silveira', 'Arnaldo Baldessin Junior', 'Fabio Boligon']","['NAO', 'SIM', 'NAO', 'NAO', 'NAO', 'NAO']",3275865819287843,Rafael Cesar Tieppo,Tieppo,"TIEPPO, R. C.;TIEPPO, RAFAEL CESAR;TIEPPO, RAFAEL CÉSAR;R. C. TIEPPO",Cascavel,PR,"Rafael Tieppo possui graduação em Engenharia Agícola pela Universidade Estadual do Oeste do Paraná (2001), mestrado em Engenharia Agrícola pela Universidade Estadual do Oeste do Paraná (2004) e doutorado em Engenharia de Sistemas Agrícolas pela Universidade de São Paulo, ESALQ-USP com período sanduíche na Aarhus University - Dinamarca. Atualmente é professor adjunto da Universidade do Estado de Mato Grosso. Tem experiência na área de Engenharia Agrícola, com ênfase em Otimização Sistemas Agroindustrias, atuando principalmente nos seguintes temas: geoprocessamento e mecanização agrícola.",30-11-2018,1
Software para seleção e uso otimizado de sistemas mecanizados agrícolas,1997,2001,PESQUISA,"['Rafael Cesar Tieppo', 'Jerry Adriani Johann', 'Denise Mahl', 'Eduardo Godoy de Souza', 'Carlos Antonio Antes', 'Erivelto Mercante', 'Márcio Furlan Maggi', 'Cindia Sordi', 'Miguel Angel Uribe Opazo', 'Lúcia Helena Pereira Nóbrega', 'Suedêmio de Lima Silva', 'Joaquim Odilon Pereira', 'Claudiane V. Bulcholz', 'Fábio A. da Silva', 'João Luciano Skrock', 'Lenir Mahl', 'José Paulo Molin', 'Edson Feliciano de Oliveira', 'Márcio Antonio Vilas Boas', 'Mônica Sarolli Silva', 'Selma Regina Aranha Ribeiro']","['SIM', 'NAO', 'NAO', 'NAO', 'NAO', 'NAO', 'NAO', 'NAO', 'NAO', 'NAO', 'NAO', 'NAO', 'NAO', 'NAO', 'NAO', 'NAO', 'NAO', 'NAO', 'NAO', 'NAO', 'NAO']",3275865819287843,Rafael Cesar Tieppo,Tieppo,"TIEPPO, R. C.;TIEPPO, RAFAEL CESAR;TIEPPO, RAFAEL CÉSAR;R. C. TIEPPO",Cascavel,PR,"Rafael Tieppo possui graduação em Engenharia Agícola pela Universidade Estadual do Oeste do Paraná (2001), mestrado em Engenharia Agrícola pela Universidade Estadual do Oeste do Paraná (2004) e doutorado em Engenharia de Sistemas Agrícolas pela Universidade de São Paulo, ESALQ-USP com período sanduíche na Aarhus University - Dinamarca. Atualmente é professor adjunto da Universidade do Estado de Mato Grosso. Tem experiência na área de Engenharia Agrícola, com ênfase em Otimização Sistemas Agroindustrias, atuando principalmente nos seguintes temas: geoprocessamento e mecanização agrícola.",30-11-2018,1
Software de planejamento racional de propriedades agrícolas,1997,2001,PESQUISA,"['Rafael Cesar Tieppo', 'Jerry Adriani Johann', 'Denise Mahl', 'Eduardo Godoy de Souza', 'Erivelto Mercante', 'Márcio Furlan Maggi', 'Miguel Angel Uribe Opazo', 'Lúcia Helena Pereira Nóbrega', 'Suedêmio de Lima Silva', 'Joaquim Odilon Pereira', 'Fábio A. da Silva', 'João Luciano Skrock', 'Lenir Mahl', 'José Paulo Molin', 'Edson Feliciano de Oliveira', 'Jansle Vieira Rocha', 'Márcio Antonio Vilas Boas', 'Mônica Sarolli Silva', 'Selma Regina Aranha Ribeiro']","['NAO', 'NAO', 'NAO', 'SIM', 'NAO', 'NAO', 'NAO', 'NAO', 'NAO', 'NAO', 'NAO', 'NAO', 'NAO', 'NAO', 'NAO', 'NAO', 'NAO', 'NAO', 'NAO']",3275865819287843,Rafael Cesar Tieppo,Tieppo,"TIEPPO, R. C.;TIEPPO, RAFAEL CESAR;TIEPPO, RAFAEL CÉSAR;R. C. TIEPPO",Cascavel,PR,"Rafael Tieppo possui graduação em Engenharia Agícola pela Universidade Estadual do Oeste do Paraná (2001), mestrado em Engenharia Agrícola pela Universidade Estadual do Oeste do Paraná (2004) e doutorado em Engenharia de Sistemas Agrícolas pela Universidade de São Paulo, ESALQ-USP com período sanduíche na Aarhus University - Dinamarca. Atualmente é professor adjunto da Universidade do Estado de Mato Grosso. Tem experiência na área de Engenharia Agrícola, com ênfase em Otimização Sistemas Agroindustrias, atuando principalmente nos seguintes temas: geoprocessamento e mecanização agrícola.",30-11-2018,1
Variabilidade espacial dos atributos do solo e da produtividade em uma área de agricultura de precisão,1998,2001,PESQUISA,"['Rafael Cesar Tieppo', 'Jerry Adriani Johann', 'Denise Mahl', 'Eduardo Godoy de Souza', 'Erivelto Mercante', 'Márcio Furlan Maggi', 'Miguel Angel Uribe Opazo', 'Lúcia Helena Pereira Nóbrega', 'Suedêmio de Lima Silva', 'Joaquim Odilon Pereira', 'Fábio A. da Silva', 'João Luciano Skrock', 'Lenir Mahl', 'José Paulo Molin', 'Edson Feliciano de Oliveira', 'Jansle Vieira Rocha', 'Márcio Antonio Vilas Boas', 'Mônica Sarolli Silva', 'Selma Regina Aranha Ribeiro']","['NAO', 'NAO', 'NAO', 'SIM', 'NAO', 'NAO', 'NAO', 'NAO', 'NAO', 'NAO', 'NAO', 'NAO', 'NAO', 'NAO', 'NAO', 'NAO', 'NAO', 'NAO', 'NAO']",3275865819287843,Rafael Cesar Tieppo,Tieppo,"TIEPPO, R. C.;TIEPPO, RAFAEL CESAR;TIEPPO, RAFAEL CÉSAR;R. C. TIEPPO",Cascavel,PR,"Rafael Tieppo possui graduação em Engenharia Agícola pela Universidade Estadual do Oeste do Paraná (2001), mestrado em Engenharia Agrícola pela Universidade Estadual do Oeste do Paraná (2004) e doutorado em Engenharia de Sistemas Agrícolas pela Universidade de São Paulo, ESALQ-USP com período sanduíche na Aarhus University - Dinamarca. Atualmente é professor adjunto da Universidade do Estado de Mato Grosso. Tem experiência na área de Engenharia Agrícola, com ênfase em Otimização Sistemas Agroindustrias, atuando principalmente nos seguintes temas: geoprocessamento e mecanização agrícola.",30-11-2018,1
Métodos Geoestatísticos no estudo da variabilidade espacial de atributos físicos do solo e da produtividade,1999,2001,PESQUISA,"['Rafael Cesar Tieppo', 'Eduardo Godoy de Souza', 'Erivelto Mercante', 'Reny Adilmar Prestes Lopes', 'Miguel Angel Uribe Opazo', 'Lúcia Helena Pereira Nóbrega', 'Edson Feliciano de Oliveira', 'Jansle Vieira Rocha', 'Márcio Antonio Vilas Boas', 'Roberto Cláudio Machado de Souza']","['NAO', 'SIM', 'NAO', 'NAO', 'NAO', 'NAO', 'NAO', 'NAO', 'NAO', 'NAO']",3275865819287843,Rafael Cesar Tieppo,Tieppo,"TIEPPO, R. C.;TIEPPO, RAFAEL CESAR;TIEPPO, RAFAEL CÉSAR;R. C. TIEPPO",Cascavel,PR,"Rafael Tieppo possui graduação em Engenharia Agícola pela Universidade Estadual do Oeste do Paraná (2001), mestrado em Engenharia Agrícola pela Universidade Estadual do Oeste do Paraná (2004) e doutorado em Engenharia de Sistemas Agrícolas pela Universidade de São Paulo, ESALQ-USP com período sanduíche na Aarhus University - Dinamarca. Atualmente é professor adjunto da Universidade do Estado de Mato Grosso. Tem experiência na área de Engenharia Agrícola, com ênfase em Otimização Sistemas Agroindustrias, atuando principalmente nos seguintes temas: geoprocessamento e mecanização agrícola.",30-11-2018,1
Desenvolvimento de um penetrômetro eletrônico e elaboração de mapas temáticos de resisttência a penetração e compactação de latossolo bruno utilizando um sistema de posicionamento global,2002,2004,PESQUISA,"['Rafael Cesar Tieppo', 'Antonio Gabriel Filho', 'Suedêmio de Lima Silva', 'João Cleber Modernel da Silveira']","['NAO', 'SIM', 'NAO', 'NAO']",3275865819287843,Rafael Cesar Tieppo,Tieppo,"TIEPPO, R. C.;TIEPPO, RAFAEL CESAR;TIEPPO, RAFAEL CÉSAR;R. C. TIEPPO",Cascavel,PR,"Rafael Tieppo possui graduação em Engenharia Agícola pela Universidade Estadual do Oeste do Paraná (2001), mestrado em Engenharia Agrícola pela Universidade Estadual do Oeste do Paraná (2004) e doutorado em Engenharia de Sistemas Agrícolas pela Universidade de São Paulo, ESALQ-USP com período sanduíche na Aarhus University - Dinamarca. Atualmente é professor adjunto da Universidade do Estado de Mato Grosso. Tem experiência na área de Engenharia Agrícola, com ênfase em Otimização Sistemas Agroindustrias, atuando principalmente nos seguintes temas: geoprocessamento e mecanização agrícola.",30-11-2018,1
Demanda energética de uma semeadora de plantio direto e desenvolvimento de milho (Zea mays L.) em função da velocidade de deslocamento e profundidade semeadura,2003,2004,PESQUISA,"['Rafael Cesar Tieppo', 'Antonio Gabriel Filho', 'Douglas Guedes Batista Torres', 'João Cleber Modernel da Silveira', 'Arnaldo Baldessin Junior', 'Fabio Boligon', 'Deonir Secco']","['NAO', 'SIM', 'NAO', 'NAO', 'NAO', 'NAO', 'NAO']",3275865819287843,Rafael Cesar Tieppo,Tieppo,"TIEPPO, R. C.;TIEPPO, RAFAEL CESAR;TIEPPO, RAFAEL CÉSAR;R. C. TIEPPO",Cascavel,PR,"Rafael Tieppo possui graduação em Engenharia Agícola pela Universidade Estadual do Oeste do Paraná (2001), mestrado em Engenharia Agrícola pela Universidade Estadual do Oeste do Paraná (2004) e doutorado em Engenharia de Sistemas Agrícolas pela Universidade de São Paulo, ESALQ-USP com período sanduíche na Aarhus University - Dinamarca. Atualmente é professor adjunto da Universidade do Estado de Mato Grosso. Tem experiência na área de Engenharia Agrícola, com ênfase em Otimização Sistemas Agroindustrias, atuando principalmente nos seguintes temas: geoprocessamento e mecanização agrícola.",30-11-2018,1
